{
  "$schema": "../../schema/spell.json",
  "name": "Web",
  "tier": 2,
  "class": ["wizard"],
  "duration": "5 rounds",
  "range": "Far",
  "description": "You create a near-sized cube of sticky, dense spider web within the spell's range. A creature stuck in the web can't move and must succeed on a Strength check vs. your spellcasting check to free itself.",
  "source": "data/source/quickstart-set.json"
}
