{
  "$schema": "../../schema/spell.json",
  "name": "Floating Disk",
  "tier": 1,
  "class": ["wizard"],
  "duration": "10 rounds",
  "range": "Near",
  "description": "You create a floating, circular disk of force with a concave center. It can carry up to 20 gear slots. It hovers at waist level and automatically stays within near of you. It can't cross over drop-offs or pits taller than a human.",
  "source": "data/source/quickstart-set.json"
}
