{
  "$schema": "../../schema/spell.json",
  "name": "Cleansing Weapon",
  "tier": 2,
  "class": ["priest"],
  "duration": "5 rounds",
  "range": "Close",
  "description": "One weapon you touch is wreathed in purifying flames. It deals an additional 1d4 damage (1d6 vs. undead) for the duration.",
  "source": "data/source/quickstart-set.json"
}
