{
  "$schema": "../../schema/spell.json",
  "name": "Alter Self",
  "tier": 2,
  "class": ["wizard"],
  "duration": "5 rounds",
  "range": "Close",
  "description": "You magically change your physical form, gaining one feature that modifies your existing anatomy. For example, you can grow functional gills on your neck or bear claws on your fingers. This spell can't grow wings or limbs.",
  "source": "data/source/quickstart-set.json"
}
