{
  "$schema": "../../schema/spell.json",
  "name": "Detect Thoughts",
  "tier": 2,
  "class": ["wizard"],
  "duration": "Focus",
  "range": "Near",
  "description": "You peer into the mind of one creature you can see within the spell's range. Each round, you learn the target's immediate thoughts. On its turn, the target makes a Wisdom check vs. your last spellcasting check. If the target succeeds, it notices your presence in its mind and the spell ends.",
  "source": "data/source/quickstart-set.json"
}
