{
  "$schema": "../../schema/spell.json",
  "name": "Turn Undead",
  "tier": 1,
  "class": ["priest"],
  "duration": "Instant",
  "range": "Near",
  "description": "You rebuke undead creatures, forcing them to flee. You must present a holy symbol to cast this spell. Undead creatures within near of you must make a CHA check opposed by your spellcasting check. If a creature fails by 10+ points and is equal to or less than your level, it is destroyed. Otherwise, on a fail, it flees from you for 5 rounds.",
  "source": "data/source/quickstart-set.json"
}
