{
  "$schema": "../../schema/spell.json",
  "name": "Alarm",
  "tier": 1,
  "class": ["wizard"],
  "duration": "1 day",
  "range": "Close",
  "description": "You touch one object, such as a door threshold, setting a magical alarm on it. If any creature you do not designate while casting the spell touches or crosses past the object, a magical bell sounds in your head.",
  "source": "data/source/quickstart-set.json"
}
