{
  "$schema": "../../schema/spell.json",
  "name": "Detect Magic",
  "tier": 1,
  "class": ["wizard"],
  "duration": "Focus",
  "range": "Near",
  "description": "You can sense the presence of magic within near range for the spell's duration. If you focus for two rounds, you discern its general properties. Full barriers block this spell.",
  "source": "data/source/quickstart-set.json"
}
