{
  "$schema": "../../schema/spell.json",
  "name": "Blind/Deafen",
  "tier": 2,
  "class": ["priest"],
  "duration": "Focus",
  "range": "Near",
  "description": "You utter a divine censure, blinding or deafening one creature you can see in range. The creature has disadvantage on tasks requiring the lost sense.",
  "source": "data/source/quickstart-set.json"
}
