{
  "$schema": "../../schema/spell.json",
  "name": "Magic Missile",
  "tier": 1,
  "class": ["wizard"],
  "duration": "Instant",
  "range": "Far",
  "description": "You have advantage on your check to cast this spell. A glowing bolt of force streaks from your open hand, dealing 1d4 damage to one target.",
  "source": "data/source/quickstart-set.json"
}
