{
  "$schema": "../../schema/spell.json",
  "name": "Shield of Faith",
  "tier": 1,
  "class": ["priest"],
  "duration": "5 rounds",
  "range": "Near",
  "description": "A protective force wrought of holy conviction surrounds a creature you designate. The target gains a +2 bonus to their armor class for the duration.",
  "source": "data/source/quickstart-set.json"
}
