{
  "$schema": "../../schema/spell.json",
  "name": "Knock",
  "tier": 2,
  "class": ["wizard"],
  "duration": "Instant",
  "range": "Near",
  "description": "A door, window, gate, chest, or portal you can see within range instantly opens, defeating all mundane locks and barriers. This spell creates a loud knock audible to all within earshot.",
  "source": "data/source/quickstart-set.json"
}
