{
  "$schema": "../../schema/spell.json",
  "name": "Silence",
  "tier": 2,
  "class": ["wizard"],
  "duration": "Focus",
  "range": "Far",
  "description": "You magically mute sound in a near cube within the spell's range. Creatures inside the area are deafened, and any sounds they create cannot be heard.",
  "source": "data/source/quickstart-set.json"
}
