{
  "$schema": "../../schema/spell.json",
  "name": "Smite",
  "tier": 2,
  "class": ["priest"],
  "duration": "Instant",
  "range": "Near",
  "description": "You call down punishing flames on a creature you can see within range. It takes 1d6 damage.",
  "source": "data/source/quickstart-set.json"
}
